source,country,review_id,author,rating,title,body,version,updated
app_store,us,14195327144,TheUnknownPersone,1,Premium,"You can do anything with premium. You can’t skip songs, view lyrics, and so annoying to try to listen to albums!",9.1.56,2026-06-17T16:44:35-07:00
app_store,us,14195326943,Hayden Marts,5,Spotify review,This app is so good with the premium but it’s not to good if you don’t have premium but you can still play any song you want there’s gust adds when you don’t have premium,9.1.56,2026-06-17T16:44:30-07:00
app_store,us,14195325944,clownwipes,1,Upping price for slop content,"This app is simply slop now. The price is ridiculous, even with a student discount it’s hardly worth it. Honestly, ever since Spotify ran ads for ICE and they added their newest and sloppiest AI features I’ve been getting increasingly fed up using this app and being reliant on it for my music listening. It stinks because I’ve used Spotify for almost 10 years now but with the increasing cost, I’m going back to physical media as a way to listen to music. I’m tired of rolling over for the “convenience” it’s only convenient because they’re letting it be and who knows how much longer it’ll be until it’s up there with Netflix living in the land of out-pricing the consumer. 👎👎👎",9.1.56,2026-06-17T16:44:05-07:00
app_store,us,14195308270,lLaNdAnl,5,.,better then yt,9.1.56,2026-06-17T16:36:49-07:00
app_store,us,14195302650,Russ puss,3,Ads,The ads are so much,9.1.56,2026-06-17T16:34:31-07:00
app_store,us,14195301873,Good and Fun and Relaxing,5,Awesome Sauce,Awesome sauce,9.1.56,2026-06-17T16:34:12-07:00
app_store,us,14195292882,Anonymous potato carrot,4,Spodify’s recommendation is slacking,"Due to a mistake that my brother made, he watched youtube videos on my spodify account. After an entire year, videos related to what he watch still pops up on my recommendation even after I click not interested everytime it comes up. Other than that I love the app and use it constantly.",9.1.56,2026-06-17T16:30:30-07:00
app_store,us,14195254100,Tiger7stripe,1,Smart shuffle,"This is terrible it’s been annoying me all day. I just want to listen to a specific artist without the next song being recommended by Spotify. You can only get rid of it with premium I’m not buying premium to pay to listen to music. I can’t even listen to songs without the next song being different than what I want. You can’t change any of it in settings, I searched it up and I did everything it said. Google also said it is a feature forced by Spotify you can only change with the premium. What’s the point of having playlists if it’s just gonna change what you’re listening to. I’ve spent 20 minutes trying to fix it and it’s not working. it’s so frustrating I hate this app so much. My settings don’t even have an option for smart shuffle. If a developer is seeing this please respond to my comment I’m looking for help and I want to keep listening to the music I want.",9.1.56,2026-06-17T16:15:09-07:00
app_store,us,14195250305,P. Thomb,1,Used to be better,"5 years ago I could play my music with no issue, set my playlists and listen to them without constant 2-5 minute interruptions. Yes there were still ads but it’s CONSTANT now, I’ll have a 3 ad break that lasts 2 mins then one song will play and then I’ll have 3-4 more ads. Absolutely ridiculous. Then my music won’t even play, just recommend songs instead of the album I want to listen to. Almost unusable at this point.",9.1.56,2026-06-17T16:13:39-07:00
app_store,us,14195246421,bob linskoni,1,Too many paywalls,"I have only 6 skips an hour, and I can’t choose the song I want to listen too on my own playlist. The randomized playlists and queues, but now I can’t even choose the first song I want to play.",9.1.56,2026-06-17T16:12:06-07:00
app_store,us,14195227662,djdfkkkfjgj,5,Goated,"Love this app, Easily the best music sevice out their, I tried youtube music (Sucks) and Apple music (Fine.) and a couple others. This ones the best",9.1.56,2026-06-17T16:04:31-07:00
app_store,us,14195224632,Mega sonic battle star,5,What Amazon Music should’ve been,"It’s going great so far, no hurdles or anything",9.1.56,2026-06-17T16:03:20-07:00
app_store,us,14195218191,Skip ads pls,4,Let me skip ads,Would be a 5 if I could skip ads at least,9.1.56,2026-06-17T16:00:49-07:00
app_store,us,14195215368,Guillermo2742,5,Tirado Welding,La mejor. 💪🏻,9.1.56,2026-06-17T15:59:39-07:00
app_store,us,14195214647,Kenny mini,5,Love,I like that you can listen to the song and watch videos at the same time and you can broadcast your favorite song and make your own playlist,9.1.56,2026-06-17T15:59:23-07:00
app_store,us,14195198863,Kategivesusreviews,5,Best app,"This is my most used app by far. Affordable and reliable. It doesn’t have all my favorite songs, but the well-known artists are here. Its algorithm to recommend new music according to your taste is also spectacular.",9.1.56,2026-06-17T15:53:03-07:00
app_store,us,14195195797,Mjfangurlll,5,Why I love Spotify,"I love Spotify for a lot of reasons, I love it bc I get to make my own playlists and I love listening to mj and there’s all of his songs on here, I like how there’s audiobooks too, and the episodes like you can watch some YouTubers without being on Yt! And I thing it’s really cool,",9.1.56,2026-06-17T15:51:51-07:00
app_store,us,14195191782,Katrina123123,1,Not free at all,why is everything i want to do i have to pay for? I recommend apple music if your paying anyways because it actually its actually worth your money.,9.1.56,2026-06-17T15:50:16-07:00
app_store,us,14195186897,Aqsan,5,Thank you for changing the logo back!!,Overall very happy with the service but ECSTATIC they changed the logo back I couldn’t see the other one very well. PLEASE keep it this way the translucent was Awful!,9.1.56,2026-06-17T15:48:19-07:00
app_store,us,14195186053,C. Ronaldo 18,5,Cr7,very gory goosh he he he he SIUUU,9.1.56,2026-06-17T15:47:59-07:00
app_store,us,14195176932,CapCut es el peor,5,Music lover,I love music and I love how yall add the lyrics and plis never delete this app:3….,9.1.56,2026-06-17T15:44:25-07:00
app_store,us,14195154543,Comedians Mosco,5,Music,I love playing music from here but the advertising is too much the time someone may enjoy the lyrics the will put on advertising,9.1.56,2026-06-17T15:35:28-07:00
app_store,us,14195149929,Liz-Lizard,3,"24 bit is nice, why do downloaded songs keep deleting?","Apps works just fine and the 24 bit lossless audio is finally nice enough to no longer miss apple music, but why do my downloaded songs cycle through deletion and forced redownloads? Why do I have to keep the app open to download?

Waste of time and bandwidth.",9.1.56,2026-06-17T15:33:38-07:00
app_store,us,14195130753,PinchRozen613,5,Everything,Every song u ask for is on here and there are no ads (because I have premium) but the videos are amazing and there is nothing to just just not love about it!!,9.1.56,2026-06-17T15:26:07-07:00
app_store,us,14195129903,Ivalee s,5,Ily Spotify,"I’ve used this app for the past 6 years, nothing tops it",9.1.56,2026-06-17T15:25:47-07:00
app_store,us,14195121360,Jenboi7,5,NO ADS,Just no ads and the app would be amazing,9.1.56,2026-06-17T15:22:26-07:00
app_store,us,14195114370,Smurfy-Lee,1,Disappearing audiobooks mid-read,I was reading strength of the few on this app. I ran out of listening hours because you only get 15 hours. You need two months to finish an epic novel as a result. Fine. Now I check back and I see the book is gone. What the heck?! I know you guys suspect tracks regularly but audiobooks? This is really not right. Not a fan of your audiobook platform if this is what you are going to be doing.,9.1.56,2026-06-17T15:19:44-07:00
app_store,us,14195107860,Christen Neff,5,Spotify,Spotify is great! Great music and can have restrictions for kids based on their songs!,9.1.56,2026-06-17T15:17:16-07:00
app_store,us,14195104148,Is the  best evert,5,The best,I love thank you who made Spotify is so good I love it I use it all days and is the best,9.1.56,2026-06-17T15:15:51-07:00
app_store,us,14195098846,Toe Tickler 😝,2,Good and bad,Even after the update every now and then it will go back to only 6 skips per hour and I cant afford premium!!!! and also I think this is new because it didnt do this before but now everytime i full screen the song thats playing it gives me an ad instead if the music video!!!!!!!!!!!! but overall its a good app blah blah blah k bye! ❤️,9.1.56,2026-06-17T15:13:48-07:00
app_store,us,14195083445,Shade412 Productions,5,Best app,Wish it was cheaper but definitely will to pay to not hear tampon adds lol,9.1.56,2026-06-17T15:07:51-07:00
app_store,us,14195075235,Tu tangas,3,Anuncio,Ay muchos anucios en cuando cambia la canción,9.1.56,2026-06-17T15:04:44-07:00
app_store,us,14195074595,Sorry I voted a 4 star,5,Spotify review,"This is a GREAT app, All the time when i wanna relax , I just blast some songs on Spotify! There isn’t any ads and it’s free! You don’t need WiFi too so it’s great for road trips.
Absolutely a GREAT app!",9.1.56,2026-06-17T15:04:29-07:00
app_store,us,14195051668,ibrahopro,5,To spotify,You are the best only,9.1.56,2026-06-17T14:55:49-07:00
app_store,us,14195044624,Chilly Dee !,4,Love this app .,"I so love this app.
Spotify is really great , I use it for music & podcasts .",9.1.56,2026-06-17T14:53:07-07:00
app_store,us,14195042277,🐓 Pip,5,MY LITERAL LIFELINE,"I love Spotify so much! It’s probably definitely my go to listening platform, also the process for putting music on Spotify is so smooth. I am a premium listener, which is totally worth it, but also I feel like the only way to listen to Spotify is through premium with no ads and being able to do you want I love Spotify and definitely is my choice!",9.1.56,2026-06-17T14:52:13-07:00
app_store,us,14195034869,PaulAlexL,1,Poor offline performance,The app works extremely badly in offline mode or when there is no internet (e.g. downloaded albums don’t open). Feels like creators have never been on a subway train.,9.1.56,2026-06-17T14:49:28-07:00
app_store,us,14195031386,•Sprout•,4,It’s great except for the amount of adds,It works amazing I’ve been using Spotify for around 5 years now my only promise the adds bc because it has you listening to four or five adds at once after like 5 to 4 songs.,9.1.56,2026-06-17T14:48:05-07:00
app_store,us,14195028715,Cassgibbonss,3,Best option for free music but shuffle and song radios are horrible,"In my opinion, Spotify is the best for free music with no ads. When I’m not focusing on music and just need it for background noise it’s great but when I want specific artists or vibes when it comes to playlists they are trash. The same songs in every playlist. Very few news songs or artists added to them. It just makes it feel like I’m listening to the same 15 songs over and over again. Give me something new and not just the same mainstream bs you always do.",9.1.56,2026-06-17T14:47:02-07:00
app_store,us,14195024443,k-beastie,5,The best,There’s literally no reason to complain,9.1.56,2026-06-17T14:45:27-07:00
app_store,us,14195010583,Winston puffles,3,Explicit content blocker  and ads,It’s good but I’m old enough for Spotify but it has a blocker for explicit music. Also it has very long ads.,9.1.56,2026-06-17T14:40:16-07:00
app_store,us,14195007770,Summerpeonies,5,C,I use this 24/7 I have a lot of playlists and I put it when I’m feeling any emotion,9.1.56,2026-06-17T14:39:15-07:00
app_store,us,14194989203,nanananannannandbdhd,3,ts pmo,premium too expensive u support ice like its just not worth it to support a racist hoe company,9.1.56,2026-06-17T14:32:24-07:00
app_store,us,14194985261,Joshua R….,5,Oh yk,This is the best thing that ever happened to me only review ive ever wrote to.,9.1.56,2026-06-17T14:30:55-07:00
app_store,us,14194981546,bloommama,5,The G O A T,"Awesome app for music all day, everyday!😜😎🔥",9.1.56,2026-06-17T14:29:34-07:00
app_store,us,14194979166,Justaplayer1324,5,10 stars recommend very much,Good songs and you can connect with friends I love listening to audio books that I don’t have to pay for (you have to keep looking for the ones that are free so you do t have to pay),9.1.56,2026-06-17T14:28:40-07:00
app_store,us,14194977542,I got a brand new saxophone,4,.,"I just hate the constant ads and the new layout, that’s all.",9.1.56,2026-06-17T14:28:04-07:00
app_store,us,14194968389,claudia burgoa,5,Sebbywood,Heroes Unite,9.1.56,2026-06-17T14:24:39-07:00
app_store,us,14194961765,Аnqwr,2,Такое себе,"Приложения хорошое, но, НО, ЭТО БРЕД, ЧТО ЛЮДИ ХОТЯТ ПОСЛУШАТЬ СПОКОЙНО МУЗЫКУ, А ТУТ РЕКЛАМА С НИФИГА , НО ЛАДНО ЕЩЕ РЕКЛАМА, НО ТО ЧТО БЕЗ ПОДПИСКИ НЕЛЬЗЯ СЛУШАТБ ТРЕКИ ПО ПОРЯДКУ ИЗВИНИТЕ МЕНЯ ДАЙТЕ ЛБДЯМ НОРМ МУЗЫКУ ПОСЛУШАТЬ",9.1.56,2026-06-17T14:22:12-07:00
app_store,us,14194961632,Asix6x,5,Oliver Tree,WE LOVE U OLIVER REST IN PEACE,9.1.56,2026-06-17T14:22:09-07:00
app_store,us,14194947084,evamaburn,1,Free version doesn't play the songs in the Playlist,"I don't use this enough to be worth paying for a subscription. When I do use it, it's too listen to a few specific songs, but the free version will pick one song from the Playlist I want to listen to, then after that it plays a random song (not from the Playlist) that it thinks is ""related"" to that list. This does not help me at all.",9.1.56,2026-06-17T14:16:51-07:00
app_store,us,14194934502,Bill’sreview,4,Unwanted selection,Automatically loaded a selection I don’t want and now I can’t delete it.,9.1.56,2026-06-17T14:12:17-07:00
app_store,us,14194933736,DottieGer,1,Sellouts,Ai slop,9.1.56,2026-06-17T14:12:01-07:00
app_store,us,14194928423,Gods Rosalina,5,I love Spotify so so much,"I really like Spotify because I like that u can look at like kinda like see YouTube shorts kinda and u can also listen to songs too
So YEAH THAT IS WHY I LOVE IT SO SO MUCH🫶🏼
And I also love Mexican music which is mariachi and other songs too but I love Spotify so so much",9.1.56,2026-06-17T14:10:08-07:00
app_store,us,14194922149,MaximilianArturu,5,thank you for fixing the icon,the best again,9.1.56,2026-06-17T14:07:54-07:00
app_store,us,14194917195,big dawg ss,5,1,absolutely perfect,9.1.56,2026-06-17T14:06:07-07:00
app_store,us,14194899593,Darxth,5,My Type Of Vibe,When it comes to character lores and new beginnings Spotify is the app for it all. 👑×͜×👑,9.1.56,2026-06-17T13:59:51-07:00
app_store,us,14194889910,Erock315,5,Love it but…,"I’ve been using Spotify my whole life and always have a good experience with it. But i would like the ability to remove all duplicate songs from my playlists. So if songs are on my playlist twice and I don’t want them to be, i can just click a button and remove all duplicates.",9.1.56,2026-06-17T13:56:30-07:00
app_store,us,14194885855,Ethier5751,3,Half and half,"So I’ve been a long term user of Spotify since I’ve basically had a phone. I’ve always preferred this app over Apple Music, but recently it’s been glitchy, not loading songs and just all around being slow. I have about 7 thousand liked songs but I will continue to hear the same 10 songs play. I’m getting irritated with this and I’m considering canceling my subscription altogether and switching to Apple Music. It’s a huge disappointment for me because this app was great until recently when it seems to always crash and give me problems. Anyways if you’re going to charge 13 dollars a month I expect better quality out of the app. 
Thanks.",9.1.56,2026-06-17T13:55:04-07:00
app_store,us,14194872020,iloveracehorses,5,DISCO BALL,"Please bring back the disco ball, or at least make it to where we can customize it into a disco ball I loved it 😭",9.1.56,2026-06-17T13:50:09-07:00
app_store,us,14194864257,Hi hdhdh,5,Hi,Hi,9.1.56,2026-06-17T13:47:22-07:00
app_store,us,14194861173,Jean35ant0s,2,Ads,"I really enjoy using this app, but now I can’t listen any podcast episodes without listening to a bunch of ads in the middle of the episode AND I’M PAYING FOR A PREMIUM ACCOUNT. Doesn’t make any sense! It sucks bro 🤯",9.1.56,2026-06-17T13:46:15-07:00
app_store,us,14194860696,Lowcountry Juan,1,Playlists,Wish the radio playlists etc were more dynamic and played more perpetually à la Pandora,9.1.56,2026-06-17T13:46:05-07:00
app_store,us,14194848035,Idk it’s tiring,5,Spotify,It’s peak,9.1.56,2026-06-17T13:41:34-07:00
app_store,us,14194842241,GlitchesAlot69,1,Glitches,Glitches when I’m driving,9.1.56,2026-06-17T13:39:32-07:00
app_store,us,14194834552,It’s not playing my music,1,It’s not playing my music,It’s not playing my music,9.1.56,2026-06-17T13:36:50-07:00
app_store,us,14194807804,❤️🎄⛄️,5,Why I love Spotify,I love Spotify it is amazing I love my playlists I love how it makes me playlists I really wish I had premium my mom said no but I do really want it love ur music❤️,9.1.56,2026-06-17T13:27:25-07:00
app_store,us,14194803790,souljadave,1,Scrolling glitch for the e longest,For the past month and some change when you go to your artists liked songs it won’t let you scroll all the way down leaving like 5 songs all the way at the bottom you can’t press play on,9.1.56,2026-06-17T13:25:58-07:00
app_store,us,14194801642,Cool and good👍👍👍,5,Best app ever,This is the BEST APP EVER,9.1.56,2026-06-17T13:25:14-07:00
app_store,us,14194798895,Gracias por tus servicios,5,Gracias Spotify,Pues opino que es una buena app me encanta de verdad,9.1.56,2026-06-17T13:24:16-07:00
app_store,us,14194788184,yoyo579201,5,W,Literally the best app ever made,9.1.56,2026-06-17T13:20:33-07:00
app_store,us,14194773862,Gia123lover,4,LOVE IT!!!,"I have always had premium so for premium listeners it is great but I’ve heard it’s horrible for not premium listeners so if you’re not a premium, then you might need to find a different app or pay premium but it’s like all my favorite songs. Everyone posted on it’s great thank you!!!!",9.1.56,2026-06-17T13:15:33-07:00
app_store,us,14194769393,Leeaaaaaahhhhhhhh,5,Love,Love it,9.1.56,2026-06-17T13:14:00-07:00
app_store,us,14194768915,conner.n,5,I love this app!!!!!!!,I don’t know what to say other than this is the best music streaming service,9.1.56,2026-06-17T13:13:50-07:00
app_store,us,14194765964,Mustard mango 6777,4,: ),W app,9.1.56,2026-06-17T13:12:50-07:00
app_store,us,14194752175,"King of kings, Jesus",5,Great app,"Spotify is easy to use and a great music app fantastic great music selection, number one app in music 1",9.1.56,2026-06-17T13:07:55-07:00
app_store,us,14194734403,TikTok needs Banning,1,Review,"The reason I rate it a 1 is because the ads only the ad’s, that’s why I went to Apple Music",9.1.56,2026-06-17T13:01:50-07:00
app_store,us,14194732114,كاطقرووحكوىطنًكة,1,Against genocide support,"Will not associate my self with genocide supporter no way , America first !
Your app is deleted",9.1.56,2026-06-17T13:01:03-07:00
app_store,us,14194712767,TopDiner,5,Best Streaming App,Endless amounts of great music for any event or situation. Love Spotify 💚🎵🎼🎶,9.1.56,2026-06-17T12:54:31-07:00
app_store,us,14194709901,VN_23@14,5,Review,The best music appp!!,9.1.56,2026-06-17T12:53:34-07:00
app_store,us,14194709574,ImortalHidan,4,Ehh,Too many adds but good,9.1.56,2026-06-17T12:53:28-07:00
app_store,us,14194706341,I’Yunna,5,the best music app,this app is the best thing every and it only give you 1 to 4 adds thats only 15sc long and ii love this🫶🏾,9.1.56,2026-06-17T12:52:22-07:00
app_store,us,14194700320,Donn juxx,3,Spotify,I love Spotify but it’s just to many adds like I just got the app and I’m already getting five adds,9.1.56,2026-06-17T12:50:20-07:00
app_store,us,14194691476,Papi schushy,5,Spotify,Love the music by Malcom Todd 😮‍💨,9.1.56,2026-06-17T12:47:21-07:00
app_store,us,14194684530,Isaac Elall,5,Spotifai,Lo mejor que me pasó en la vida y lo más útil,9.1.56,2026-06-17T12:45:02-07:00
app_store,us,14194674201,But I already know what I,5,Cognac queen repeat,I like it because I always listen to cognac queen on repeat for HOURS,9.1.56,2026-06-17T12:41:38-07:00
app_store,us,14194668731,droppin'in,1,Keeps cutting out,"Music on Spotify keeps cutting out. Now I guess you have to pay more to listen to music that doesn’t cut out on Spotify???? I think it’s called lossless or something?  I already pay Spotify to listen to music. Should be simple, but it’s not simple. If music on Spotify can’t play without interruptions, I’m just going to cancel.",9.1.56,2026-06-17T12:39:47-07:00
app_store,us,14194662774,LEBRON JaMeS17,5,Bro,"Fantastic app, works amazing, allow us to swap the disco app icon tho",9.1.56,2026-06-17T12:37:46-07:00
app_store,us,14194652551,Premium…🙄,3,Need to pay for everything,"If u don’t have premium your doomed 
It’s was harder the music isn’t as good and I’m switching!",9.1.56,2026-06-17T12:34:22-07:00
app_store,us,14194634292,justtakeitdownalready,5,spotify,Spotify has been a life saver and i’ve been using it all the time would absolutely recommend for anyone who loves music.,9.1.56,2026-06-17T12:28:20-07:00
app_store,us,14194629731,Gadiel Vazquez,5,by Gadiel,really good i love the song and i can see my favorate youtuber,9.1.56,2026-06-17T12:26:51-07:00
app_store,us,14194627501,Kenzie Dodson 67,4,Spotify,It is amazing but I can’t find some songs so it’s kinda annoying,9.1.56,2026-06-17T12:26:07-07:00
app_store,us,14194617994,Cashvlev,4,❤️❤️❤️❤️,"I love everything about it, but there was just one tiny itty-bitty thing. I don’t really like about it. It’s that whenever you watch a video or a podcast or whatever you want it always freezes and you have to pause it to make it work or you just have to pick a different thing and I don’t really like that but that’s fine. I still love the music.",9.1.56,2026-06-17T12:22:59-07:00
app_store,us,14194607047,Sams NET,5,The Best Music APP,"I use it daily, for times that are up or times that are mellow. I build memories and reconnect to memories all right here. It’s what a music driven or listener can escape too. Plus the audio books as well as podcast to stay up to date on my favorite topics. I love it. Also music tickets being accessible if you’re a big fan of an artist.",9.1.56,2026-06-17T12:19:22-07:00
app_store,us,14194593859,SJBTIB,5,🗣️,THE BEST APPPPPP,9.1.56,2026-06-17T12:15:03-07:00
app_store,us,14194591409,Tanis-,5,spot,good,9.1.56,2026-06-17T12:14:15-07:00
app_store,us,14194577335,Not a Fan dot com,1,Terrible.,Advertisements after every song w the free version of Spotify has really irritated me. Shoving ads down our throats literally every 3 minutes as if your app can't sustain itself at this point. It keeps deleting songs off my Liked songs playlist as well.,9.1.56,2026-06-17T12:09:41-07:00
app_store,us,14194575471,Vandervenlelander,5,Thanks,Spotify has helped me through my highs and lows thank you for this,9.1.56,2026-06-17T12:09:06-07:00
app_store,us,14194570593,"Aja.,:—",5,Genial,Genial,9.1.56,2026-06-17T12:07:33-07:00
app_store,us,14194568078,Josh is cool fr,5,pretty cool heh,cool app that u can find prob any song by any artist and has lots of niche artists,9.1.56,2026-06-17T12:06:43-07:00
app_store,us,14194564464,Unaa nenaaa,5,EL GOAT,me gusta mucho lo uso todo el tiempo es una de mis redes favoritass💞,9.1.56,2026-06-17T12:05:33-07:00
app_store,us,14194557305,n4tjk,2,too many ads,i love the app but they charge for everything plus too many ads cant enjoy my music for shi 💔😭,9.1.56,2026-06-17T12:03:20-07:00
app_store,us,14194556717,￼ Love to read 777,5,Love but ..,"OK, so I love this app I have Apple Music and I use this app when I’m bored but this one problem that ads Apple Music does not have any I would like it if you could just make it so one add per song and that’s it not an ad during the song oh and also a suggestion do you think you could make it so you can like skip as many songs as you would like?",9.1.56,2026-06-17T12:03:09-07:00
app_store,us,14194539283,love it so does sister,5,Spofy,I love the spotiffy,9.1.56,2026-06-17T11:57:39-07:00
app_store,us,14194538114,Skylur Is so amazing 😍,4,Review,I didn’t really like how if you don’t have premium you have to watch up to 10 minutes of ads.  I also don’t like that you can only listen to like 3 songs and then have to listen to a 10 minute ad.,9.1.56,2026-06-17T11:57:15-07:00
app_store,us,14194536182,Willy$999,5,Best app,Better then Apple Music,9.1.56,2026-06-17T11:56:35-07:00
app_store,us,14194527858,Incredibox Fan.,1,I hate it,"Way too many ads just delete this that’s why YouTube music is better when you get a ad you can skip but in Spotify, you can’t -1 quadrillion stars just delete this",9.1.56,2026-06-17T11:53:47-07:00
app_store,us,14194510116,Littlewafflebit,2,YES,"Literally all my favorite music is here and I know I don’t wanna be like those stupid ads, trying to encourage you to use it but honestly, I have a five out of five rating. It is so good. I can find all my audiobooks. I can find all my music that I want. I can find everything that needs to be there. It is great.",9.1.56,2026-06-17T11:47:57-07:00
app_store,us,14194495517,Doom and despair,1,So many ads,"This app irritates me so much. There are constantly ads after every song, sometimes the ads are longer than the song u just listened to! When I first started listening to songs on spotify, there were much fewer ads, but the number constantly increased as time went on.",9.1.56,2026-06-17T11:43:15-07:00
app_store,us,14194476561,Monster Jerky,4,Repetitive,Very good range once it figures out what you like it only play as the same two dozen songs.,9.1.56,2026-06-17T11:37:04-07:00
