source,country,review_id,author,rating,title,body,version,updated
app_store,gb,14178377923,Eviecarter,2,you can’t do anything without premium,okay so it’s a generally good app but im getting ads every 2 songs and it’s rlly distracting having to listen to them and they annoying music in the back when im trying to study for my exams and just listen to music and how the ads are sometimes 4 at a time which is 2 mins also when it plays suggested songs like ive turned off the function but it still does it,9.1.50,2026-06-13T09:03:09-07:00
app_store,gb,14178368180,satorugojo(thestongest),3,suggestion,pls can you bring back the heart button when you favourite songs ✨🗣️💔,9.1.50,2026-06-13T09:00:16-07:00
app_store,gb,14178344328,Twisuzbhe2311,5,Good,It’s a good app to listen to songs I would recommend to anyone,9.1.50,2026-06-13T08:53:12-07:00
app_store,gb,14178335031,Jfybebdhh in e,5,Love it,Such good quality,9.1.50,2026-06-13T08:50:31-07:00
app_store,gb,14178318734,Cold ahh reviews,5,Very good,Very good should use I recommend,9.1.50,2026-06-13T08:45:43-07:00
app_store,gb,14178309822,maimai mia,1,Premium,"Spotify is so money hungry for premium, they shove the idea down your throat, and also sometimes it stops playing and then it doesn’t turn back on",9.1.50,2026-06-13T08:43:03-07:00
app_store,gb,14178290123,Amdlemwe,1,Yet another new Spotify,"With AI? A talking AI? Better to search previously with a list, not having something second guessing.",9.1.50,2026-06-13T08:37:12-07:00
app_store,gb,14178196506,Abdul Al Badawi,5,Spotify podcast,Music,9.1.50,2026-06-13T08:09:38-07:00
app_store,gb,14178183705,SPURSFAN4EVER,5,SPOTIFY,"I LOVE IT SO MUCH 
It makes me want to listen to more songs every time I go on it",9.1.50,2026-06-13T08:05:55-07:00
app_store,gb,14178081213,Lcfino,5,Great,"Great experience even with the free version,",9.1.50,2026-06-13T07:36:17-07:00
app_store,gb,14178012660,Tanya allowitya,5,s,LOVE spotify but the only thing they need to do is stop the ads and limited skipsz,9.1.50,2026-06-13T07:16:25-07:00
app_store,gb,14177787796,Buddydabest144,5,I love Spotify,Have all my favourite songs phonks and all sorts thank you Spotify,9.1.50,2026-06-13T06:09:32-07:00
app_store,gb,14177720776,Paracetamol 21,5,Spotify,I love you,9.1.50,2026-06-13T05:48:44-07:00
app_store,gb,14177579902,sladybun,3,New disadvantage of having a free Spotify,Great app but I don’t know if it’s a glitch or something but I can’t move to a certain part of songs.it would be better if this was fixed,9.1.50,2026-06-13T05:02:44-07:00
app_store,gb,14177532694,Priya  John,5,Good,Hello,9.1.50,2026-06-13T04:46:35-07:00
app_store,gb,14177505154,George Tommy 123,5,GIOANNOU,Just play any music you want there’s no better then Spotify,9.1.50,2026-06-13T04:36:54-07:00
app_store,gb,14177502639,A1ACTIVE12,5,Spotify,Spotify da goat 🐐,9.1.50,2026-06-13T04:36:02-07:00
app_store,gb,14177486949,lols123rm,3,It’s good with premium,it’s good with premium but the amt of skips u have are lowkey so bad..,9.1.50,2026-06-13T04:30:42-07:00
app_store,gb,14177458010,Pigeongirl100,5,Spotify,Really good one of my fave apps and I can listen to my Stray kids songs😆 (and all the K-pop💛🥹) skz is the best🥰☺️🥹 OH sorry I’m of topic defo recommend DOWNLOAD NOW 🙂😍😇🥰,9.1.50,2026-06-13T04:20:43-07:00
app_store,gb,14177443476,Otter forsaken,3,Premium,Spotify is brilliant if you can be bothered to spend that money other wise it’s okay the app is built really well,9.1.50,2026-06-13T04:15:30-07:00
app_store,gb,14177428231,Robster85,5,The leader,"Easy to use, good aesthetic and the original streaming app will always stick with the OG",9.1.50,2026-06-13T04:10:00-07:00
app_store,gb,14177401677,Fireboiler,5,Football songs,What a library to listen too for down the pub on Wednesday 1st game of the 26 World Cup,9.1.50,2026-06-13T04:00:25-07:00
app_store,gb,14177378567,petegreppel,5,Can’t be without it!,"As someone who loves music so much- it’s just absolutely changed the overall experience of enjoying, categorising as well as exploring new music!!!",9.1.50,2026-06-13T03:51:44-07:00
app_store,gb,14177363214,daanyh98,5,❤️,❤️,9.1.50,2026-06-13T03:45:54-07:00
app_store,gb,14177256199,mwwhale,1,The icon was appalling,1 star for telling us that it would only be in place for a week.,9.1.50,2026-06-13T03:03:40-07:00
app_store,gb,14177213729,Teddy does reviews,5,Soo good,Spotify is great for listening to great music,9.1.50,2026-06-13T02:46:19-07:00
app_store,gb,14177185314,Th3collector,5,Oasis,Champagne Supernova!!!,9.1.50,2026-06-13T02:34:30-07:00
app_store,gb,14177174677,viiipple,1,The old icon is still not back,Enough this is ugly disco ball plz,9.1.50,2026-06-13T02:30:08-07:00
app_store,gb,14177149337,A in snn B la,5,Spotify,"Only complaint is the ads, and I could get rid of that with Spotify premium 😂😂",9.1.50,2026-06-13T02:19:30-07:00
app_store,gb,14177141829,HuhThatDoesntWork,3,Scammed?,Purchased platinum plan. Used two different cards to pay. Both debited. But membership failed. Then used bank account. Again money debited but membership still not working,9.1.50,2026-06-13T02:16:20-07:00
app_store,gb,14177106143,Nainmall,1,Ads,Ads issu this is not the way you are treating your uses to iritate every time,9.1.50,2026-06-13T02:01:31-07:00
app_store,gb,14177027122,BurnageBlue,1,Pay your artists more,Pay your artists more,9.1.50,2026-06-13T01:28:20-07:00
app_store,gb,14177002597,Kakashighh,5,Wohhhh,Love it,9.1.50,2026-06-13T01:18:12-07:00
app_store,gb,14176952526,Roxyshahidi,5,❤️,AMAZING!!! ⭐️⭐️⭐️⭐️⭐️,9.1.50,2026-06-13T00:57:06-07:00
app_store,gb,14176909441,ButterbeePippi,5,Spotify,I really like Spotify I only listen to songs on it e.g play lists. But it’s very good sometimes in the updates I need to try to find a way to navigate around the app but it all makes sence after a minute or two love it!-Em,9.1.50,2026-06-13T00:38:41-07:00
app_store,gb,14176898708,🤡🙌🏻🤷🏻‍♂️,5,I don’t really need to say much,"It’s Spotify, you know it already. Only wish is I could listen to mixes like on SoundCloud 🤔😌",9.1.50,2026-06-13T00:34:08-07:00
app_store,gb,14176636393,Amelia2469,5,Amazing,Amazing just need to stop trying to charge us for skips on songs,9.1.50,2026-06-12T22:40:43-07:00
app_store,gb,14176383897,jerusalem123098,5,Best platform,"I love Spotify. Best platform of mixed things - classical music mixes (that are actually enjoyable for someone who doesn’t like much classical music), all kinds of pop/punk/folk/country/charts podcast, even audio books and more. Having used probably all of the other platforms in separate apps, I’m sticking with Spotify now.",9.1.50,2026-06-12T20:50:23-07:00
app_store,gb,14176318036,nickyhunt70,2,Random,"Plays songs randomly that are not on my playlist, really annoying",9.1.50,2026-06-12T20:23:04-07:00
app_store,gb,14176236561,u   me=<3 forever,5,Hello,No adds for everyone,9.1.50,2026-06-12T19:50:20-07:00
app_store,gb,14176067289,FT596293,1,Slow and laggy,"I pay for Premium, I’ve cleared my cache, uninstalled and reinstalled many times and this app is still extremely slow and laggy, it’s bordering on unusable. Don’t bother, YT Premium is the better option at this point.",9.1.50,2026-06-12T18:44:42-07:00
app_store,gb,14175609254,let play roblx,5,Spotify,IT TO PERFECT I LOVE IT,9.1.50,2026-06-12T15:45:24-07:00
app_store,gb,14175574732,Inaya ✨,5,Tout les titres ma vibe quoi,J’adore cette appli quand j’ai des problèmes ou j’ai envie de pleurer je mets une chanson et ça m’apaise direct mon appli préféré 😘✨,9.1.50,2026-06-12T15:31:37-07:00
app_store,gb,14175482559,Tea drinker 20,4,My opinion,It’s amazing but there is to many adverts and I do not want to pay for premium subscription and I don’t like being stuck with 3 adverts at one,9.1.50,2026-06-12T14:55:23-07:00
app_store,gb,14175343816,leepy50,5,Chosen music,Love music I like and can save and play many time has I want,9.1.50,2026-06-12T14:03:04-07:00
app_store,gb,14175283789,Lovely Spotty fie,5,It’s great,I love it because you can listen to multiple things,9.1.50,2026-06-12T13:41:24-07:00
app_store,gb,14175270645,.......……….…,5,Ads,Stop ads,9.1.50,2026-06-12T13:36:44-07:00
app_store,gb,14175251372,J_leo2,4,No Apple dj,Great app but still no Apple dj or virtual dj support,9.1.50,2026-06-12T13:30:01-07:00
app_store,gb,14175094886,TGOD123🥇,4,4/5,The best place to listen to music ever but adds let it down a lot because I don’t want to buy premium,9.1.50,2026-06-12T12:36:18-07:00
app_store,gb,14175088918,Witty-witch,5,Help me listen to the songs in my library,I like the songs here. But it will be so  good for me if the advertisement stops playing . Please help me listen to my fav songs in my library . 🥺 also please let me listen to my liked songs offline,9.1.50,2026-06-12T12:34:17-07:00
app_store,gb,14175060550,😬🥸😬,4,🥲,Premium is too expensive for teenagers to pay for,9.1.50,2026-06-12T12:24:47-07:00
app_store,gb,14175004785,Kaotic6952,5,I love Spotify,The funk songs are so smooth on Spotify,9.1.50,2026-06-12T12:06:24-07:00
app_store,gb,14174999930,Vy_🏳️‍🌈,5,I love it even though I don’t have the subscription,So first I just wanna say there are ads but it still works normally and I watched TADC on it so Absolute BOP,9.1.50,2026-06-12T12:04:51-07:00
app_store,gb,14174997455,Leila cohen 🌊🧿💙,5,Amazing! 🤩,Made me feel all warm inside and actually helped me audition for a Disney show! Thanks Spotify!,9.1.50,2026-06-12T12:04:01-07:00
app_store,gb,14174995311,MadPhatChick,5,Spotify,❤️,9.1.50,2026-06-12T12:03:17-07:00
app_store,gb,14174971041,Snack dog.,5,Goodddd,N,9.1.50,2026-06-12T11:55:17-07:00
app_store,gb,14174955097,Love  this app x,5,Spotify,Love the songs what it’s got and it’s just amazing x,9.1.50,2026-06-12T11:50:04-07:00
app_store,gb,14174924439,Peaker then peak,5,Peak,Peak,9.1.50,2026-06-12T11:40:08-07:00
app_store,gb,14174863151,Musokota brian,5,Great experience,Will never stop paying. Best app ever!!,9.1.50,2026-06-12T11:20:25-07:00
app_store,gb,14174849243,Rènne,5,AMAZING!! 🙌🎉,This is such a fun way to watch / listen to your favourite podcast this is like the biggest game changer ever for me because like I feel like just put the headphones in and zone out !!,9.1.50,2026-06-12T11:15:54-07:00
app_store,gb,14174807486,Nicepanda200,5,Spotify,"Oh my God, I love this app so much it helps me in my music videos. I’m becoming an artist. I am nine and I love. This nice panda 200.",9.1.50,2026-06-12T11:02:44-07:00
app_store,gb,14174746812,Apfeswaho Baloyi,5,Happiest app,Spotify is the only music app that offers free musics no subscription fees if you do not want premium music,9.1.50,2026-06-12T10:43:26-07:00
app_store,gb,14174746786,julie_the_great,5,Fgixxiigtxutizxigfuxgzizif,Hsdyssriusritssitsruursfjzzgizgxufzurxiktzxkktxtxixti flogging office jfk go zfiigstitztzifzfzjgzifuf,9.1.50,2026-06-12T10:43:26-07:00
app_store,gb,14174550152,Spotifine,5,The Best,"Until something better comes along, I’ll stick with Spotify. It’s the best out there at the moment…",9.1.50,2026-06-12T09:43:05-07:00
app_store,gb,14174443426,Mim 🎧,5,Good,Soooooo gooooooooodddddddddddd,9.1.50,2026-06-12T09:11:57-07:00
app_store,gb,14174423829,Liam 11  w         The years,5,Best music streaming app,You can’t beat Spotify! I’ve been them since nearly the beginning! They are always innovating the app! Keep it up Spotify,9.1.50,2026-06-12T09:06:23-07:00
app_store,gb,14174373688,Thaya 01,5,Amazing,Adds are short,9.1.50,2026-06-12T08:52:13-07:00
app_store,gb,14174342678,philbuild,5,Love this,"Keeping memories alive, love that you can find tunes from back when tunes were proper tunes!",9.1.50,2026-06-12T08:43:33-07:00
app_store,gb,14174297706,Mikey’s 44,5,Spotify,Great listing platform,9.1.50,2026-06-12T08:30:59-07:00
app_store,gb,14174261844,zakariyah.,5,love,i love you so much,9.1.50,2026-06-12T08:21:08-07:00
app_store,gb,14174228992,Filip’s fav songs,5,My fav songs,"I love Spotify my fav songs are Dai Dai, pinky up and whenever",9.1.50,2026-06-12T08:12:13-07:00
app_store,gb,14174170478,Hate this app_bad,4,Review,really good but would be better with no ads ❤️🤏😅,9.1.50,2026-06-12T07:57:08-07:00
app_store,gb,14174168621,yo721,5,idk,music saved my life bro,9.1.50,2026-06-12T07:56:38-07:00
app_store,gb,14173930860,Kay7684,1,Annoyed,Practically ever week Spotify gets changed. Most of my saved songs are no longer saved. So annoying.,9.1.50,2026-06-12T06:55:31-07:00
app_store,gb,14173650365,nugget123nugget,5,brilliant great,lovley,9.1.50,2026-06-12T05:31:52-07:00
app_store,gb,14173400349,Sophieeeeeeee29,5,Olivia Rodrigo,I love all of her songs they’re all so good,9.1.50,2026-06-12T04:07:23-07:00
app_store,gb,14173271756,kzz.kl -tiktok,5,spotify,dank songs,9.1.50,2026-06-12T03:18:07-07:00
app_store,gb,14173246961,Mya…—-,5,Absolutely amazing,"I love spotify, paying the premium is absolutely worth it",9.1.50,2026-06-12T03:08:08-07:00
app_store,gb,14173128691,LIneecho,1,Ugly app now with uglier icon,"How can I change it back, it’s not funny. Need option to remove podcasts and audiobooks from homepage - they keep turding the experience",9.1.50,2026-06-12T02:17:44-07:00
app_store,gb,14173083105,Jermaine Gayle,5,Gayle,Great app,9.1.50,2026-06-12T01:57:46-07:00
app_store,gb,14173071367,callidiet,5,Love it,"Been with Spotify for ten years and honestly couldn’t live without it ! For running and dancing , ANY genre I want ❤️",9.1.50,2026-06-12T01:52:32-07:00
app_store,gb,14173062163,Mohsin.khurshid,5,❤️❤️❤️,Love Spotify ❤️,9.1.50,2026-06-12T01:48:19-07:00
app_store,gb,14172869050,Shastar ✨,5,The best decision you’ll ever make!!!!,No explanation needed just get it already,9.1.50,2026-06-12T00:19:10-07:00
app_store,gb,14172866261,Thank - you,5,Best music app ever,Spotify is filled with music and podcasts that are absolutely amazing! Also with Amazon music it doesn’t load but this does ! ❤️❤️❤️,9.1.50,2026-06-12T00:17:52-07:00
app_store,gb,14172855360,Happypopgirl10,5,The best,10/10,9.1.50,2026-06-12T00:12:47-07:00
app_store,gb,14172793611,livlolaluke,5,.,i love spotify they have every song i want to listen to and even suggest great songs for me to listen too. and the dj thing is so cool.,9.1.50,2026-06-11T23:43:52-07:00
app_store,gb,14171849861,rucking fidiculous,5,Music,"Music good, music tasty, music smell good, it look good, feel good, sounds perfect. if spotify was food id probably eat it everyday",9.1.50,2026-06-11T16:58:35-07:00
app_store,gb,14171843863,Ddmfnnf,5,Spotify,I love this app it is so good i just love it,9.1.50,2026-06-11T16:56:04-07:00
app_store,gb,14171674949,jaisifjckfof,1,:(,"Bad.
Don’t bother buying premium. No matter what you’ll do, you’ll have adds. If the app crashes? It’ll show you adds. Did it show you adds before crashing? Doesn’t matter. They’ll take the profit 

It has the potential to be a good app. Sure. But Spotify is no more than a disgusting money grab. It’ll pretend to give you premium (premium means you can actually listen to music) but the second you pay for premium it’ll trap you on the adds only service. Another product ruined by mass media and the need to pay hundreds for music. Sure Spotify may be good, but not as good as other services. Don’t expect my money next month.",9.1.50,2026-06-11T15:46:30-07:00
app_store,gb,14171645838,bob hghjfbmn,4,Amazing but adds,This is an absolute masterpiece of an app buttttt these adds ruin the experience! I think it should atleast be 10 songs then an add!,9.1.50,2026-06-11T15:34:41-07:00
app_store,gb,14171640921,DNW!!!!!!!!!!,3,Spotify,Too many adds,9.1.50,2026-06-11T15:32:41-07:00
app_store,gb,14171623958,seanmanning42,3,alraight,bad without premium but premium is very expensive,9.1.50,2026-06-11T15:25:49-07:00
app_store,gb,14171603375,The mighty pigs,5,The mighty pigs,It is great I love to listen to music,9.1.50,2026-06-11T15:17:37-07:00
app_store,gb,14171575718,PurpleRainUK,5,Have always enjoyed using Spotify,"I’m a long time subscriber to Spotify Premium even though I live in the Apple ecosphere. I’m at ease and at home with how Spotify arranges its music, podcasts and audiobooks all within the same app, the way the music is managed and how new stuff is suggested to me. Spatial sound may be missing but all your other sound resolutions exist. For the most part, the catalogue of music available meets my requirements.",9.1.50,2026-06-11T15:06:40-07:00
app_store,gb,14171570495,AdSpaced,5,"Old icon is back, good.",Thanks for changing it back from the disco ball thing.,9.1.50,2026-06-11T15:04:36-07:00
app_store,gb,14171506688,Ingress.South Wales,5,MUSIC,"OMg.I was born. And music came into my soul.I’m so pleased I have Spotify. Now aged 65. Been through the vinyl.tapes.cd.mo3 etc…
I’ve made it to this technology….
That will do… thanks Spotify.",9.1.50,2026-06-11T14:39:50-07:00
app_store,gb,14171488990,Butler579,2,Changed pro plan to start including ads on pod casts,As title suggests!,9.1.50,2026-06-11T14:33:14-07:00
app_store,gb,14171348232,tyyrtrrffsh has so endearin,5,Da Beat,This is simply the best musical app of all time,9.1.50,2026-06-11T13:42:25-07:00
app_store,gb,14171227421,Slayyyyyyyyyy🦄,5,Slay app,I love this app because i don’t have youtube but i can watch youtube on spotify,9.1.50,2026-06-11T13:01:44-07:00
app_store,gb,14171215968,emerfun,5,Michael Jackson,Mj king of pop,9.1.50,2026-06-11T12:58:04-07:00
app_store,gb,14171201360,skibidislicerHeheheh,1,bro,"Don’t get makes u pay to even choose what you want to listen to, it chooses everything not worth it",9.1.50,2026-06-11T12:53:24-07:00
app_store,gb,14171169871,Doge is bro,5,Best Music app ever made,So good!Now i can listen to cool music and search for more music 😊,9.1.50,2026-06-11T12:43:11-07:00
app_store,gb,14171168299,kermit theigh frog,1,Unusable,Completely unusable for a non paying user,9.1.50,2026-06-11T12:42:42-07:00
app_store,gb,14171156844,Jackdyergooner,5,"Dear Spotify,",I love Spotify and playing music,9.1.50,2026-06-11T12:39:04-07:00
app_store,gb,14171108401,Evie rose walker,1,Spotify,It’s so godddd,9.1.50,2026-06-11T12:23:57-07:00
app_store,gb,14171107777,celestialseraph,1,its getting worse,ts literally sucks so much now 💔🥀,9.1.50,2026-06-11T12:23:46-07:00
app_store,gb,14171092412,Days love girl,1,No no no,It has change I want to lissen to a song and it puts a different song on like EXCUSE ME,9.1.50,2026-06-11T12:18:59-07:00
app_store,gb,14171082077,ʟᴏᴡʀɪ,5,Very good,Very good if want music offline and onlo,9.1.50,2026-06-11T12:15:48-07:00
app_store,gb,14170997645,Kksahha,5,Positive comments,I love Spotify allot.  I listen to music every day.   Tysm for playing them for me ❤️,9.1.50,2026-06-11T11:49:48-07:00
app_store,gb,14170862799,Tomboy Xxx,5,Love it,"I have had it for years and I love it. Search up ANY song and it will come up. It’s fantastic. Amazing sound quality. Tip, my fav song is chlorine by twenty one pilots.",9.1.48,2026-06-11T11:09:50-07:00
app_store,gb,14170822346,Hazel Angela,5,Top tier,Been using this app since 2014,9.1.50,2026-06-11T10:57:45-07:00
app_store,gb,14170799086,Mg££,3,Spotify is annoying,Way to many adds feel like they are getting greedy with the money might move to Apple Music,9.1.50,2026-06-11T10:50:38-07:00
app_store,gb,14170645899,Hyu*utvuyv,5,G,Amazing  it is so good,9.1.50,2026-06-11T10:04:44-07:00
app_store,gb,14170565861,Sasha11b,5,My review,"I use Spotify almost everyday and would recommend this as the best music app,there are all kinds of genres and it’s easy to make a playlist with your favourite tracks in the click of a button,the only downfall to the app is the frequent amount of ads throughout song to song and I know this won’t be an issue to most people I just find it slightly irritating ,overall I’ve never regretted installing this app and you won’t too xx",9.1.50,2026-06-11T09:40:48-07:00
app_store,gb,14170556428,MrGryff,1,useless,the app controls everything!,9.1.50,2026-06-11T09:38:00-07:00
app_store,gb,14170510146,laptoplid,4,It’s great but…,It would be great to be able to export/copy playlists and albums between accounts,9.1.48,2026-06-11T09:24:14-07:00
app_store,gb,14170461738,Olllie pa,5,Rate,Very good just too many ads,9.1.48,2026-06-11T09:10:02-07:00
app_store,gb,14170426961,Amk1435,5,Amk,Amk,9.1.48,2026-06-11T08:59:48-07:00
app_store,gb,14170370957,Alisea61,5,Sooo joyful,My most used app love the weekly music chosen for me,9.1.48,2026-06-11T08:43:30-07:00
app_store,gb,14170349541,PaoloDicanio,4,Dumb changes,Had a family subscription for years. Was great but recently to many adds or unwanted questions take over the screen and you have to dismiss it. Never convenient and no one ever asked for it. And that stupid new logo needs to go. Who ever thought of that needs to jog on.,9.1.48,2026-06-11T08:37:14-07:00
app_store,gb,14170321271,2ndbesthumanever,5,Music🎶🎶🎶,An amazing Rich variety of music absolutely wonderful. I would recommend you hundred percent play Stars yeah it’s just so much so much music yeah yeah it makes me wanna boogy,9.1.48,2026-06-11T08:28:59-07:00
app_store,gb,14170180387,Jaxon arthur Whitby,1,Worst app,Sucks you have to pay for skips and playsongs,9.0.48,2026-06-11T07:48:19-07:00
app_store,gb,14170111775,Fish tank98,5,Mad good,"Brilliant would recommend 10/10,",9.1.48,2026-06-11T07:28:23-07:00
app_store,gb,14169961124,🌏🌞🌎,5,😃,👍,9.1.48,2026-06-11T06:44:09-07:00
app_store,gb,14169817677,Sonia090,5,Amazing,Love  love love Spotify,9.1.48,2026-06-11T06:01:08-07:00
app_store,gb,14169779976,Robbo1267,5,Amazing,Love Spotify so does my family we take it everywhere the music range is fantastic we couldn’t  be without it love premium,9.1.48,2026-06-11T05:49:21-07:00
app_store,gb,14169693098,Mazza 2.o,5,Best music platform,I love listening on Spotify because it is just so much better than anything else I can’t lie thank you for making Spotify a thing again thank you,9.1.48,2026-06-11T05:21:50-07:00
app_store,gb,14169317908,Creamageddon,1,Complaint,Slow and annoying doesn’t load really debating moving to a different app,9.1.48,2026-06-11T03:05:40-07:00
app_store,gb,14169169456,qbee1977,5,Love it,"Just jamming on my ,so chill love you goys bye",9.1.48,2026-06-11T02:00:59-07:00
app_store,gb,14169008892,🫪✌️🇬🇧🤏🥱🤮😂,5,Amazing,The sound is amazing good songs,9.1.48,2026-06-11T00:46:18-07:00
app_store,gb,14168954378,67momo,5,Spotify,Omg amazing for music I absolutely love it and recommend it,9.1.48,2026-06-11T00:20:27-07:00
app_store,gb,14168896752,Stella O,5,Mrs,No regrets subscribing,9.1.48,2026-06-10T23:53:06-07:00
app_store,gb,14168883926,maxpugh,5,Brilliant but one thing,So ive been using spotify since 2024 i have premium and ive enjoyed it slot but without premium you are limited so idk try it out i guess,9.1.48,2026-06-10T23:47:07-07:00
app_store,gb,14168883201,Alan Grossmith,4,Great app but still missing that key ingredient,"hence the 4 stars instead of 5.  I have used Spotify for several years and it is great. However, it is still missing one feature that users have asked for time and time again on the Spotify community and that is to allow users to save albums into genre folders. There are workarounds apparently that can be done on a desktop but let’s keep it simple for those on the move; subscribing customers wanting be able to save favourite albums in folders as genres. I would like a go to place where I can pick, for example, an 80’s album from a collection I have centralised in the app. I don’t want to download each individual song into its own single folder as that is not helpful.  It’s in the art of the possible to design, so come on Spotify, give the people what they want and leave the other music apps even further bring. Thank you.",9.1.48,2026-06-10T23:46:47-07:00
app_store,gb,14168875315,Dem--,1,Change the icon back,Looks dismal,9.1.48,2026-06-10T23:43:01-07:00
app_store,gb,14168776550,BeckyIsMyLife_36,3,Feature creep is slowly ruining this thing,"Still great for streaming music and giant library but this app was getting so slow on my phone that it discouraged me from using it at all. Everything feels designed in the model of social media now: there’s tiktok-style discovery features and even a messaging feature for some reason. Also every song has four or five different features to scroll down: lyrics, about the artist, this useless “song dna” feature which I’m not sure actually does anything, artist’s mercy, etc. This overload of useless features meant that it would take two minutes at a time for anything to load on my phone, to the point where I had to delete the app altogether and put it onto a dummy phone for my patience’s sake. Maybe this app is just teaching me to appreciate the slow internet of the 90’s, but it needs some genuine redesigning. Please get rid of these nonsensical add-ons, or even make a mode where you can only see the bare minimum possible to use it. Using this app makes me crave old MP3 players with 2cm squared of screen.",8.9.8,2026-06-10T22:56:06-07:00
app_store,gb,14168437806,axh__,3,🙏,🤷‍♀️,9.1.48,2026-06-10T20:21:09-07:00
